{
  "schemaVersion": "1.0",
  "requestId": "probe-fixture-004",
  "connectionId": "bridge-connection-7f3c",
  "profileRef": {
    "profileId": "fixture.synthetic-socket",
    "revision": 2,
    "fingerprint": "sha256:1111111111111111111111111111111111111111111111111111111111111111"
  },
  "configRevision": 4,
  "configFingerprint": "sha256:2222222222222222222222222222222222222222222222222222222222222222",
  "nonMutating": true,
  "status": "SUCCEEDED",
  "startedAt": "2026-08-24T19:05:03Z",
  "completedAt": "2026-08-24T19:05:04Z",
  "checks": [
    {
      "key": "listener-bind",
      "status": "PASSED",
      "messageKey": "analyzer.probe.listener.available",
      "durationMillis": 14,
      "details": {
        "fieldKey": "listenerPort"
      }
    }
  ]
}
